{"$defs":{"content_ref":{"additionalProperties":false,"properties":{"byte_length":{"minimum":0,"type":"integer"},"relative_path":{"minLength":1,"type":"string"},"sha256":{"pattern":"^[0-9a-f]{64}$","type":"string"}},"required":["byte_length","relative_path","sha256"],"type":"object"}},"$id":"urn:rd22:step11:sp1-07:formal-manifest:v001","$schema":"https://json-schema.org/draft/2020-12/schema","additionalProperties":false,"properties":{"artifacts":{"additionalProperties":false,"properties":{"completeness_certificate":{"$ref":"#/$defs/content_ref"},"composition_schema":{"$ref":"#/$defs/content_ref"},"derivation_grammar":{"$ref":"#/$defs/content_ref"},"expected_ledger":{"$ref":"#/$defs/content_ref"},"expected_schema":{"$ref":"#/$defs/content_ref"},"proof_index":{"$ref":"#/$defs/content_ref"},"proof_schema":{"$ref":"#/$defs/content_ref"},"typed_graph":{"$ref":"#/$defs/content_ref"},"typed_graph_schema":{"$ref":"#/$defs/content_ref"}},"required":["completeness_certificate","composition_schema","derivation_grammar","expected_ledger","expected_schema","proof_index","proof_schema","typed_graph","typed_graph_schema"],"type":"object"},"blocks":{"items":{"type":"object"},"minItems":3,"type":"array"},"row_id":{"const":"C-B-V011-SP1-07"},"schema":{"const":"rd22.step11.sp1-07.formal-manifest.v001"},"source_pins":{"items":{"$ref":"#/$defs/content_ref"},"minItems":3,"type":"array"}},"required":["schema","row_id","source_pins","blocks","artifacts"],"title":"SP1-07 closed composition manifest","type":"object"}