{"artifacts":{"completeness_certificate":{"byte_length":1800,"relative_path":"step11_sp1_07_formal/generated/p_complete.json","sha256":"d6bb2526579c76d7e56f2603823a116186540126f507db835e57f78c38389470"},"composition_schema":{"byte_length":1516,"relative_path":"step11_sp1_07_formal/contracts/formal_manifest.schema.json","sha256":"82b3598f5a9b22e46f0e0e5663dddd21299e7904cf47b64f21a7db77d30d3ee7"},"derivation_grammar":{"byte_length":1159,"relative_path":"step11_sp1_07_formal/generated/G_overlap_order.json","sha256":"3b7dbe263087af2e8dcf0aa36cb8c0587db4563fc016a4f92a4cca7e7a48c0da"},"expected_ledger":{"byte_length":2260,"relative_path":"step11_sp1_07_formal/generated/E_SP1_07.json","sha256":"3925d5333a7c5e53c65a307630c9150a0e218d352dafd1f944abe090e3d24fc3"},"expected_schema":{"byte_length":1277,"relative_path":"step11_sp1_07_formal/contracts/expected_ledger.schema.json","sha256":"cf08e9888345916fa2f284beebc73914f61c6a819b581f8e5c6c4f556066f9fa"},"proof_index":{"byte_length":4417,"relative_path":"step11_sp1_07_formal/generated/P_SP1_07.json","sha256":"eee07455d902dd9390ddff6594b1728419096a3a23298dcc39f21cfef3b95f73"},"proof_schema":{"byte_length":2328,"relative_path":"step11_sp1_07_formal/contracts/proof_object.schema.json","sha256":"4d0a74987115ca58546ef17f88a6098fbaf58c84814f5944da52c56308ca451c"},"typed_graph":{"byte_length":1696,"relative_path":"step11_sp1_07_formal/generated/G_SP1_07.typed_graph.json","sha256":"74866ef69479dd4e12b4c8c65fb463fcf8f6474cca43323955fa3300967d973e"},"typed_graph_schema":{"byte_length":1544,"relative_path":"step11_sp1_07_formal/contracts/typed_global_graph.schema.json","sha256":"fd33eceaae65bbc95730ce11fc0941a0631040ca64f4def0a9ca2132a4ac799d"}},"blocks":[{"block_id":"B_GLOBAL_TYPED","source_sha256":"949181d78aca143ebef06eacc4ab1018d43cdf79962ee8c78c350f654a7555dd","span":[1103,1704],"span_sha256":"daeb7bc7b448e78009703e6fc7a7946a76844f7ee6f479327e63ab6ab84057d2"},{"block_id":"B_GLOBAL_DESCENT","source_sha256":"949181d78aca143ebef06eacc4ab1018d43cdf79962ee8c78c350f654a7555dd","span":[1705,4005],"span_sha256":"fcbb16c6cad76b08a210d55d42a1ce82d165ae3a0adfd63f28ba16f30946d1ce"},{"block_id":"B_GLOBAL_ORDER","source_sha256":"949181d78aca143ebef06eacc4ab1018d43cdf79962ee8c78c350f654a7555dd","span":[5027,6406],"span_sha256":"17314d1ffd972873a65ee99e3309610b70e25dfddf612dd7adb2a83df456d7ed"}],"row_id":"C-B-V011-SP1-07","schema":"rd22.step11.sp1-07.formal-manifest.v001","source_pins":[{"byte_length":7722,"relative_path":"review_packets/STAGE7_QSPEC_CANDIDATE_V001/BID_GLOBAL_BOUNDARY_DESCENT_QUASI_FREE_COMPLETENESS_V001.md","sha256":"949181d78aca143ebef06eacc4ab1018d43cdf79962ee8c78c350f654a7555dd"},{"byte_length":197462,"relative_path":"STAGE8_TASK6_A35_EVALUATOR_SPEC_LANE2_V012.md","sha256":"382052c4caf7d8d4187c3fdbe98796845060e66519e11ed3b8eb3c454b68d504"},{"byte_length":18847,"relative_path":"STAGE8_7A_U7_DISPOSITION_CODEX2_V001.md","sha256":"0145c5dbbed1681067a211021892100cf6d18c6ef25ba9c7e905aeedc8a7f20d"}]}